{
  "schemaVersion": 1,
  "synthetic": true,
  "serverInstanceId": "00000000-0000-4000-8000-000000000001",
  "revision": 0,
  "capturedAt": null,
  "devices": [
    {
      "id": "g915",
      "current": {
        "batteryPercent": 0,
        "precision": "PRECISE",
        "source": {
          "kind": "GHUB_GATEWAY",
          "socSupport": "SUPPORTED",
          "ownership": "ATTRIBUTED"
        },
        "readAt": null,
        "observedAt": null
      },
      "availability": "AVAILABLE",
      "freshness": "UNKNOWN",
      "deviceConnection": "UNKNOWN",
      "unavailableReason": null,
      "lastKnown": null
    },
    {
      "id": "g305",
      "current": {
        "batteryPercent": null,
        "precision": "UNKNOWN",
        "source": {
          "kind": "UNKNOWN",
          "socSupport": "UNKNOWN",
          "ownership": "UNKNOWN"
        },
        "readAt": null,
        "observedAt": null
      },
      "availability": "UNAVAILABLE",
      "freshness": "UNKNOWN",
      "deviceConnection": "UNKNOWN",
      "unavailableReason": "NO_READING",
      "lastKnown": null
    },
    {
      "id": "hyperx",
      "current": {
        "batteryPercent": 76,
        "precision": "ESTIMATE",
        "source": {
          "kind": "HYPERX_SUPERVISED",
          "socSupport": "NOT_APPLICABLE",
          "ownership": "AMBIGUOUS"
        },
        "readAt": null,
        "observedAt": null
      },
      "availability": "AVAILABLE",
      "freshness": "UNKNOWN",
      "deviceConnection": "UNKNOWN",
      "unavailableReason": null,
      "lastKnown": null
    }
  ]
}
